{
  "analysis_id": "b2c3d4e5-f6a7-8901-bcde-f12345678901",
  "ticker": "NVDA",
  "analysis_date": "2026-06-16",
  "depth": "shallow",
  "status": "ANALYZED",
  "delivery_type": "cron",
  "signal": {
    "rating": "HOLD",
    "action": "HOLD",
    "time_horizon": "3 months",
    "confidence": 0.50,
    "time_window": "long-term"
  },
  "summary": {
    "executive_summary": "Market is balanced.",
    "investment_thesis": "No strong directional conviction.",
    "key_risk": "Macro uncertainty."
  },
  "analysts_used": ["market", "news"],
  "completed_at": "2026-06-16T09:00:00Z",
  "created_at": "2026-06-16T08:50:00Z",
  "processing_ms": 295000
}
