{
  "analysis_id": "a1b2c3d4-e5f6-7890-abcd-ef1234567890",
  "ticker": "NVDA",
  "analysis_date": "2026-05-31",
  "depth": "shallow",
  "status": "ANALYZED",
  "delivery_type": "cron",
  "signal": {
    "rating": "BUY",
    "action": "Enter long position on a pullback to the $1,080-$1,100 support zone",
    "entry_price": 1095.0,
    "stop_loss": 1020.0,
    "price_target": 1280.0,
    "time_horizon": "3 weeks",
    "confidence": 0.74,
    "time_window": "medium-term"
  },
  "summary": {
    "executive_summary": "NVDA continues to demonstrate strong momentum driven by AI infrastructure demand. Technical setup is constructive with the stock consolidating above its 50-day moving average. Near-term catalysts include the upcoming GTC developer conference and strong forward guidance from cloud hyperscalers.",
    "investment_thesis": "Sustained AI training and inference spend by hyperscalers positions NVDA for continued earnings outperformance. The H200 and Blackwell GPU ramps are tracking ahead of consensus estimates, supporting a premium valuation multiple.",
    "key_risk": "Any slowdown in hyperscaler capex commitments or an export restriction expansion to additional GPU configurations could materially compress the near-term revenue outlook."
  },
  "analysts_used": ["Market Analyst", "News Analyst"],
  "completed_at": "2026-05-31T06:42:17Z",
  "processing_ms": 38420,
  "created_at": "2026-05-31T06:41:38Z"
}
